{
  "format": "RetroTelemetry Game Definition",
  "schema_version": 1,
  "definition_version": 1,
  "game": {
    "id": "mega-drive.mortal-kombat-3",
    "title": "Mortal Kombat 3",
    "system_id": "mega_drive",
    "aliases": [
      "Mortal Kombat 3"
    ]
  },
  "roms": [
    {
      "id": "stable-retro-genesis-integration",
      "label": "Stable-Retro Genesis integration ROM",
      "primary_hash": {
        "algorithm": "sha1",
        "value": "55CDCBA77F7FCD9994E748524D40C98089344160"
      },
      "hashes": {
        "crc32": [],
        "md5": [],
        "sha1": [
          "55CDCBA77F7FCD9994E748524D40C98089344160"
        ]
      },
      "telemetry_layout_id": "mortal-kombat-3-stable-retro-experimental",
      "verification_state": "experimental",
      "compatibility_notes": "This SHA-1 identifies the Stable-Retro integration input. Its region and revision are not asserted here; validate against the locally loaded ROM before relying on any value."
    }
  ],
  "telemetry_layouts": [
    {
      "id": "mortal-kombat-3-stable-retro-experimental",
      "title": "Mortal Kombat 3 Stable-Retro experimental layout",
      "verification_state": "experimental",
      "polling": {
        "recommended_interval_ms": 100,
        "memory_domains": [
          "core_ram"
        ]
      },
      "properties": [
        {
          "address": "0xF9D7",
          "length": 1,
          "value_type": "uint8",
          "memory_domain": "core_ram",
          "byte_order": "swap16",
          "endian": "big",
          "poll_tier": "normal",
          "category": "Stable-Retro Source Values",
          "description": "Stable-Retro integration label 'enemy_health'; source address 0x00FFF9D7 converted to core_ram offset 0xF9D7. Experimental RetroTelemetry import; runtime validation in EDAS is required.",
          "id": "enemy_health",
          "edas_alias": "enemy_health",
          "friendly_name": "Enemy health",
          "source_label": "enemy_health",
          "source_type": "|u1",
          "source_address": "0x00FFF9D7",
          "verification_state": "experimental",
          "canonical_id": "player.2.health"
        },
        {
          "address": "0xF9DD",
          "length": 1,
          "value_type": "uint8",
          "memory_domain": "core_ram",
          "byte_order": "swap16",
          "endian": "big",
          "poll_tier": "normal",
          "category": "Stable-Retro Source Values",
          "description": "Stable-Retro integration label 'enemy_matches_won'; source address 0x00FFF9DD converted to core_ram offset 0xF9DD. Experimental RetroTelemetry import; runtime validation in EDAS is required.",
          "id": "enemy_matches_won",
          "edas_alias": "enemy_matches_won",
          "friendly_name": "Enemy matches won",
          "source_label": "enemy_matches_won",
          "source_type": "|u1",
          "source_address": "0x00FFF9DD",
          "verification_state": "experimental",
          "canonical_id": "player.2.matches_won"
        },
        {
          "address": "0xF865",
          "length": 1,
          "value_type": "uint8",
          "memory_domain": "core_ram",
          "byte_order": "swap16",
          "endian": "big",
          "poll_tier": "normal",
          "category": "Stable-Retro Source Values",
          "description": "Stable-Retro integration label 'health'; source address 0x00FFF865 converted to core_ram offset 0xF865. Experimental RetroTelemetry import; runtime validation in EDAS is required.",
          "id": "health",
          "edas_alias": "health",
          "friendly_name": "Health",
          "source_label": "health",
          "source_type": "|u1",
          "source_address": "0x00FFF865",
          "verification_state": "experimental",
          "canonical_id": "player.1.health"
        },
        {
          "address": "0xF86B",
          "length": 1,
          "value_type": "uint8",
          "memory_domain": "core_ram",
          "byte_order": "swap16",
          "endian": "big",
          "poll_tier": "normal",
          "category": "Stable-Retro Source Values",
          "description": "Stable-Retro integration label 'matches_won'; source address 0x00FFF86B converted to core_ram offset 0xF86B. Experimental RetroTelemetry import; runtime validation in EDAS is required.",
          "id": "matches_won",
          "edas_alias": "matches_won",
          "friendly_name": "Matches won",
          "source_label": "matches_won",
          "source_type": "|u1",
          "source_address": "0x00FFF86B",
          "verification_state": "experimental",
          "canonical_id": "player.1.matches_won"
        },
        {
          "address": "0x0293",
          "length": 1,
          "value_type": "uint8",
          "memory_domain": "core_ram",
          "byte_order": "swap16",
          "endian": "big",
          "poll_tier": "normal",
          "category": "Stable-Retro Source Values",
          "description": "Stable-Retro integration label 'wins'; source address 0x00FF0293 converted to core_ram offset 0x0293. Experimental RetroTelemetry import; runtime validation in EDAS is required.",
          "id": "wins",
          "edas_alias": "wins",
          "friendly_name": "Wins",
          "source_label": "wins",
          "source_type": "|u1",
          "source_address": "0x00FF0293",
          "verification_state": "experimental",
          "canonical_id": "player.1.wins"
        }
      ],
      "derived_properties": [],
      "events": []
    }
  ],
  "provenance": {
    "summary": "Experimental import from publicly available Stable-Retro integration metadata. No ROM content is included. Every address, type, layout and ROM identity still requires EDAS runtime validation.",
    "sources": [
      {
        "name": "Stable-Retro",
        "repository": "Farama-Foundation/stable-retro",
        "url": "https://github.com/Farama-Foundation/stable-retro",
        "source_path": "stable_retro/data/stable/MortalKombat3-Genesis-v0",
        "data_file": "stable_retro/data/stable/MortalKombat3-Genesis-v0/data.json",
        "rom_hash_file": "stable_retro/data/stable/MortalKombat3-Genesis-v0/rom.sha",
        "accessed_at": "2026-07-31",
        "address_conversion": "Stable-Retro Genesis source addresses in the 24-bit 0xFF0000-0xFFFFFF work-RAM range are represented as 64 KiB core_ram offsets by subtracting 0xFF0000. The equivalent sign-extended 68000 range is 0xFFFF0000-0xFFFFFFFF. The EDAS Mega Drive reader convention uses byte_order swap16 and big endian.",
        "limitations": "Stable-Retro source labels and types are useful technical evidence but are not a verification claim for this exact ROM, emulator core, or EDAS runtime."
      }
    ]
  }
}
