{
  "format": "RetroTelemetry Game Definition",
  "schema_version": 1,
  "definition_version": 1,
  "game": {
    "id": "mega-drive.robocop-3",
    "title": "RoboCop 3",
    "system_id": "mega_drive",
    "aliases": [
      "RoboCop 3"
    ]
  },
  "roms": [
    {
      "id": "stable-retro-genesis-integration",
      "label": "Stable-Retro Genesis integration ROM",
      "primary_hash": {
        "algorithm": "sha1",
        "value": "7860EB700D85801831EA14501B47BCAA1753C9FC"
      },
      "hashes": {
        "crc32": [],
        "md5": [],
        "sha1": [
          "7860EB700D85801831EA14501B47BCAA1753C9FC"
        ]
      },
      "telemetry_layout_id": "robocop-3-stable-retro-experimental",
      "verification_state": "experimental",
      "compatibility_notes": "This SHA-1 identifies the Stable-Retro integration input. Its region and revision are not asserted here; validate against the locally loaded ROM before relying on any value."
    }
  ],
  "telemetry_layouts": [
    {
      "id": "robocop-3-stable-retro-experimental",
      "title": "RoboCop 3 Stable-Retro experimental layout",
      "verification_state": "experimental",
      "polling": {
        "recommended_interval_ms": 100,
        "memory_domains": [
          "core_ram"
        ]
      },
      "properties": [
        {
          "address": "0x0934",
          "length": 4,
          "value_type": "uint32",
          "memory_domain": "core_ram",
          "byte_order": "swap16",
          "endian": "big",
          "poll_tier": "normal",
          "category": "Stable-Retro Source Values",
          "description": "Stable-Retro integration label 'ammo'; source address 0x00FF0934 converted to core_ram offset 0x0934. Experimental RetroTelemetry import; runtime validation in EDAS is required.",
          "id": "ammo",
          "edas_alias": "ammo",
          "friendly_name": "Ammo",
          "source_label": "ammo",
          "source_type": ">d4",
          "source_address": "0x00FF0934",
          "verification_state": "experimental",
          "encoding": "bcd",
          "notes": "Stable-Retro source type is >d4; bcd decoding requires runtime confirmation."
        },
        {
          "address": "0x0921",
          "length": 1,
          "value_type": "uint8",
          "memory_domain": "core_ram",
          "byte_order": "swap16",
          "endian": "big",
          "poll_tier": "normal",
          "category": "Stable-Retro Source Values",
          "description": "Stable-Retro integration label 'health'; source address 0x00FF0921 converted to core_ram offset 0x0921. Experimental RetroTelemetry import; runtime validation in EDAS is required.",
          "id": "health",
          "edas_alias": "health",
          "friendly_name": "Health",
          "source_label": "health",
          "source_type": "|u1",
          "source_address": "0x00FF0921",
          "verification_state": "experimental",
          "canonical_id": "player.1.health"
        },
        {
          "address": "0x09AB",
          "length": 1,
          "value_type": "int8",
          "memory_domain": "core_ram",
          "byte_order": "swap16",
          "endian": "big",
          "poll_tier": "normal",
          "category": "Stable-Retro Source Values",
          "description": "Stable-Retro integration label 'lives'; source address 0x00FF09AB converted to core_ram offset 0x09AB. Experimental RetroTelemetry import; runtime validation in EDAS is required.",
          "id": "lives",
          "edas_alias": "lives",
          "friendly_name": "Lives",
          "source_label": "lives",
          "source_type": "|i1",
          "source_address": "0x00FF09AB",
          "verification_state": "experimental",
          "canonical_id": "player.1.lives"
        },
        {
          "address": "0x08BC",
          "length": 4,
          "value_type": "uint32",
          "memory_domain": "core_ram",
          "byte_order": "swap16",
          "endian": "big",
          "poll_tier": "normal",
          "category": "Stable-Retro Source Values",
          "description": "Stable-Retro integration label 'score'; source address 0x00FF08BC converted to core_ram offset 0x08BC. Experimental RetroTelemetry import; runtime validation in EDAS is required.",
          "id": "score",
          "edas_alias": "score",
          "friendly_name": "Score",
          "source_label": "score",
          "source_type": ">d4",
          "source_address": "0x00FF08BC",
          "verification_state": "experimental",
          "canonical_id": "player.1.score",
          "encoding": "bcd",
          "notes": "Stable-Retro source type is >d4; bcd decoding requires runtime confirmation."
        }
      ],
      "derived_properties": [],
      "events": []
    }
  ],
  "provenance": {
    "summary": "Experimental import from publicly available Stable-Retro integration metadata. No ROM content is included. Every address, type, layout and ROM identity still requires EDAS runtime validation.",
    "sources": [
      {
        "name": "Stable-Retro",
        "repository": "Farama-Foundation/stable-retro",
        "url": "https://github.com/Farama-Foundation/stable-retro",
        "source_path": "stable_retro/data/stable/RoboCop3-Genesis-v0",
        "data_file": "stable_retro/data/stable/RoboCop3-Genesis-v0/data.json",
        "rom_hash_file": "stable_retro/data/stable/RoboCop3-Genesis-v0/rom.sha",
        "accessed_at": "2026-07-31",
        "address_conversion": "Stable-Retro Genesis source addresses in the 24-bit 0xFF0000-0xFFFFFF work-RAM range are represented as 64 KiB core_ram offsets by subtracting 0xFF0000. The equivalent sign-extended 68000 range is 0xFFFF0000-0xFFFFFFFF. The EDAS Mega Drive reader convention uses byte_order swap16 and big endian.",
        "limitations": "Stable-Retro source labels and types are useful technical evidence but are not a verification claim for this exact ROM, emulator core, or EDAS runtime."
      }
    ]
  }
}
