{
  "format": "RetroTelemetry Game Definition",
  "schema_version": 1,
  "definition_version": 1,
  "game": {
    "id": "mega-drive.sonic-and-knuckles",
    "title": "Sonic & Knuckles",
    "system_id": "mega_drive",
    "aliases": [
      "Sonic & Knuckles"
    ]
  },
  "roms": [
    {
      "id": "stable-retro-integration-rom",
      "label": "Stable-Retro integration ROM (region and revision not recorded by source)",
      "primary_hash": {
        "algorithm": "sha1",
        "value": "88D6499D874DCB5721FF58D76FE1B9AF811192E3"
      },
      "hashes": {
        "crc32": [],
        "md5": [],
        "sha1": [
          "88D6499D874DCB5721FF58D76FE1B9AF811192E3"
        ]
      },
      "telemetry_layout_id": "sonic-and-knuckles-stable-retro-experimental",
      "verification_state": "experimental",
      "compatibility_notes": "Published Stable-Retro SHA-1. Region and revision require owner confirmation; no compatibility with other dumps is claimed."
    }
  ],
  "telemetry_layouts": [
    {
      "id": "sonic-and-knuckles-stable-retro-experimental",
      "title": "Sonic & Knuckles Stable-Retro experimental layout",
      "verification_state": "experimental",
      "polling": {
        "recommended_interval_ms": 100,
        "memory_domains": [
          "core_ram"
        ]
      },
      "properties": [
        {
          "id": "lives",
          "edas_alias": "lives",
          "friendly_name": "Lives",
          "category": "Player Statistics",
          "description": "Experimental raw Lives value from Stable-Retro's data.json. Original Genesis 24-bit work-RAM address 0xFFFE12 is converted to RetroArch core_ram offset 0xFE12 by subtracting 0xFF0000. Stable-Retro type is |u1. EDAS uses the Sonic 1 Mega Drive compatibility mapping (core_ram, swap16, big-endian) for this ordinary work-RAM field. It has not been tested through RetroTelemetry or EDAS.",
          "address": "0xFE12",
          "length": 1,
          "value_type": "uint8",
          "memory_domain": "core_ram",
          "byte_order": "swap16",
          "endian": "big",
          "poll_tier": "normal",
          "verification_state": "experimental",
          "notes": "Source label: lives; Stable-Retro declaration: |u1; validation required for region, revision, byte order and gameplay meaning."
        },
        {
          "id": "rings",
          "edas_alias": "rings",
          "friendly_name": "Rings",
          "category": "Game State",
          "description": "Experimental raw Rings value from Stable-Retro's data.json. Original Genesis 24-bit work-RAM address 0xFFFE20 is converted to RetroArch core_ram offset 0xFE20 by subtracting 0xFF0000. Stable-Retro type is >u2. EDAS uses the Sonic 1 Mega Drive compatibility mapping (core_ram, swap16, big-endian) for this ordinary work-RAM field. It has not been tested through RetroTelemetry or EDAS.",
          "address": "0xFE20",
          "length": 2,
          "value_type": "uint16",
          "memory_domain": "core_ram",
          "byte_order": "swap16",
          "endian": "big",
          "poll_tier": "normal",
          "verification_state": "experimental",
          "notes": "Source label: rings; Stable-Retro declaration: >u2; validation required for region, revision, byte order and gameplay meaning."
        },
        {
          "id": "score",
          "edas_alias": "score",
          "friendly_name": "Score",
          "category": "Player Statistics",
          "description": "Experimental raw Score value from Stable-Retro's data.json. Original Genesis 24-bit work-RAM address 0xFFFE26 is converted to RetroArch core_ram offset 0xFE26 by subtracting 0xFF0000. Stable-Retro type is >u4. EDAS uses the Sonic 1 Mega Drive compatibility mapping (core_ram, swap16, big-endian) for this ordinary work-RAM field. It has not been tested through RetroTelemetry or EDAS.",
          "address": "0xFE26",
          "length": 4,
          "value_type": "uint32",
          "memory_domain": "core_ram",
          "byte_order": "swap16",
          "endian": "big",
          "poll_tier": "normal",
          "verification_state": "experimental",
          "notes": "Source label: score; Stable-Retro declaration: >u4; validation required for region, revision, byte order and gameplay meaning."
        },
        {
          "id": "x",
          "edas_alias": "x",
          "friendly_name": "X",
          "category": "Player State",
          "description": "Experimental raw X value from Stable-Retro's data.json. Original Genesis 24-bit work-RAM address 0xFFB010 is converted to RetroArch core_ram offset 0xB010 by subtracting 0xFF0000. Stable-Retro type is >u2. EDAS uses the Sonic 1 Mega Drive compatibility mapping (core_ram, swap16, big-endian) for this ordinary work-RAM field. It has not been tested through RetroTelemetry or EDAS.",
          "address": "0xB010",
          "length": 2,
          "value_type": "uint16",
          "memory_domain": "core_ram",
          "byte_order": "swap16",
          "endian": "big",
          "poll_tier": "fast",
          "verification_state": "experimental",
          "notes": "Source label: x; Stable-Retro declaration: >u2; validation required for region, revision, byte order and gameplay meaning."
        },
        {
          "id": "y",
          "edas_alias": "y",
          "friendly_name": "Y",
          "category": "Player State",
          "description": "Experimental raw Y value from Stable-Retro's data.json. Original Genesis 24-bit work-RAM address 0xFFB014 is converted to RetroArch core_ram offset 0xB014 by subtracting 0xFF0000. Stable-Retro type is >u2. EDAS uses the Sonic 1 Mega Drive compatibility mapping (core_ram, swap16, big-endian) for this ordinary work-RAM field. It has not been tested through RetroTelemetry or EDAS.",
          "address": "0xB014",
          "length": 2,
          "value_type": "uint16",
          "memory_domain": "core_ram",
          "byte_order": "swap16",
          "endian": "big",
          "poll_tier": "fast",
          "verification_state": "experimental",
          "notes": "Source label: y; Stable-Retro declaration: >u2; validation required for region, revision, byte order and gameplay meaning."
        }
      ],
      "derived_properties": [],
      "events": [],
      "compatibility_notes": "All addresses are imported from the named Stable-Retro Genesis integration and converted from 24-bit work RAM. Runtime verification is required before promotion."
    }
  ],
  "provenance": {
    "migration": "Experimental definition generated from Stable-Retro integration metadata; no ROM content was downloaded or included.",
    "sources": [
      {
        "project": "Farama Foundation Stable-Retro",
        "repository": "https://github.com/Farama-Foundation/stable-retro",
        "source_directory": "stable_retro/data/stable/SonicAndKnuckles-Genesis-v0",
        "source_files": [
          "data.json",
          "rom.sha"
        ],
        "accessed": "2026-07-30",
        "address_conversion": "Stable-Retro Genesis addresses are 24-bit work-RAM addresses in 0xFF0000-0xFFFFFF. RetroArch core_ram offset = address - 0xFF0000. EDAS byte order follows the existing Sonic 1 Mega Drive compatibility mapping: swap16 plus big-endian.",
        "confidence": "experimental",
        "limitations": "Stable-Retro integration labels and SHA-1 are useful research evidence, but this definition is not runtime-tested in EDAS. The integration does not record a user-facing region/revision label."
      }
    ]
  }
}
