{
  "format": "RetroTelemetry Game Definition",
  "schema_version": 1,
  "definition_version": 1,
  "game": {
    "id": "mega-drive.street-fighter-ii-special-champion-edition",
    "title": "Street Fighter II': Special Champion Edition",
    "system_id": "mega_drive",
    "aliases": [
      "Street Fighter II': Special Champion Edition"
    ]
  },
  "roms": [
    {
      "id": "stable-retro-genesis-integration",
      "label": "Stable-Retro Genesis integration ROM",
      "primary_hash": {
        "algorithm": "sha1",
        "value": "A5AAD1D108046D9388E33247610DAFB4C6516E0B"
      },
      "hashes": {
        "crc32": [],
        "md5": [],
        "sha1": [
          "A5AAD1D108046D9388E33247610DAFB4C6516E0B"
        ]
      },
      "telemetry_layout_id": "street-fighter-ii-special-champion-edition-stable-retro-experimental",
      "verification_state": "experimental",
      "compatibility_notes": "This SHA-1 identifies the Stable-Retro integration input. Its region and revision are not asserted here; validate against the locally loaded ROM before relying on any value."
    }
  ],
  "telemetry_layouts": [
    {
      "id": "street-fighter-ii-special-champion-edition-stable-retro-experimental",
      "title": "Street Fighter II': Special Champion Edition Stable-Retro experimental layout",
      "verification_state": "experimental",
      "polling": {
        "recommended_interval_ms": 100,
        "memory_domains": [
          "core_ram"
        ]
      },
      "properties": [
        {
          "address": "0x81D5",
          "length": 1,
          "value_type": "uint8",
          "memory_domain": "core_ram",
          "byte_order": "swap16",
          "endian": "big",
          "poll_tier": "normal",
          "category": "Stable-Retro Source Values",
          "description": "Stable-Retro integration label 'continuetimer'; source address 0x00FF81D5 converted to core_ram offset 0x81D5. Experimental RetroTelemetry import; runtime validation in EDAS is required.",
          "id": "continuetimer",
          "edas_alias": "continuetimer",
          "friendly_name": "Continuetimer",
          "source_label": "continuetimer",
          "source_type": "|u1",
          "source_address": "0x00FF81D5",
          "verification_state": "experimental"
        },
        {
          "address": "0x82C2",
          "length": 2,
          "value_type": "int16",
          "memory_domain": "core_ram",
          "byte_order": "swap16",
          "endian": "big",
          "poll_tier": "normal",
          "category": "Stable-Retro Source Values",
          "description": "Stable-Retro integration label 'enemy_health'; source address 0x00FF82C2 converted to core_ram offset 0x82C2. Experimental RetroTelemetry import; runtime validation in EDAS is required.",
          "id": "enemy_health",
          "edas_alias": "enemy_health",
          "friendly_name": "Enemy health",
          "source_label": "enemy_health",
          "source_type": ">i2",
          "source_address": "0x00FF82C2",
          "verification_state": "experimental",
          "canonical_id": "player.2.health"
        },
        {
          "address": "0x8457",
          "length": 4,
          "value_type": "uint32",
          "memory_domain": "core_ram",
          "byte_order": "swap16",
          "endian": "big",
          "poll_tier": "normal",
          "category": "Stable-Retro Source Values",
          "description": "Stable-Retro integration label 'enemy_matches_won'; source address 0x00FF8457 converted to core_ram offset 0x8457. Experimental RetroTelemetry import; runtime validation in EDAS is required.",
          "id": "enemy_matches_won",
          "edas_alias": "enemy_matches_won",
          "friendly_name": "Enemy matches won",
          "source_label": "enemy_matches_won",
          "source_type": ">u4",
          "source_address": "0x00FF8457",
          "verification_state": "experimental",
          "canonical_id": "player.2.matches_won"
        },
        {
          "address": "0x8042",
          "length": 2,
          "value_type": "int16",
          "memory_domain": "core_ram",
          "byte_order": "swap16",
          "endian": "big",
          "poll_tier": "normal",
          "category": "Stable-Retro Source Values",
          "description": "Stable-Retro integration label 'health'; source address 0x00FF8042 converted to core_ram offset 0x8042. Experimental RetroTelemetry import; runtime validation in EDAS is required.",
          "id": "health",
          "edas_alias": "health",
          "friendly_name": "Health",
          "source_label": "health",
          "source_type": ">i2",
          "source_address": "0x00FF8042",
          "verification_state": "experimental",
          "canonical_id": "player.1.health"
        },
        {
          "address": "0x81DA",
          "length": 1,
          "value_type": "uint8",
          "memory_domain": "core_ram",
          "byte_order": "swap16",
          "endian": "big",
          "poll_tier": "normal",
          "category": "Stable-Retro Source Values",
          "description": "Stable-Retro integration label 'matches_won'; source address 0x00FF81DA converted to core_ram offset 0x81DA. Experimental RetroTelemetry import; runtime validation in EDAS is required.",
          "id": "matches_won",
          "edas_alias": "matches_won",
          "friendly_name": "Matches won",
          "source_label": "matches_won",
          "source_type": "|u1",
          "source_address": "0x00FF81DA",
          "verification_state": "experimental",
          "canonical_id": "player.1.matches_won"
        },
        {
          "address": "0x81E8",
          "length": 4,
          "value_type": "uint32",
          "memory_domain": "core_ram",
          "byte_order": "swap16",
          "endian": "big",
          "poll_tier": "normal",
          "category": "Stable-Retro Source Values",
          "description": "Stable-Retro integration label 'score'; source address 0x00FF81E8 converted to core_ram offset 0x81E8. Experimental RetroTelemetry import; runtime validation in EDAS is required.",
          "id": "score",
          "edas_alias": "score",
          "friendly_name": "Score",
          "source_label": "score",
          "source_type": ">d4",
          "source_address": "0x00FF81E8",
          "verification_state": "experimental",
          "canonical_id": "player.1.score",
          "encoding": "bcd",
          "notes": "Stable-Retro source type is >d4; bcd decoding requires runtime confirmation."
        }
      ],
      "derived_properties": [],
      "events": []
    }
  ],
  "provenance": {
    "summary": "Experimental import from publicly available Stable-Retro integration metadata. No ROM content is included. Every address, type, layout and ROM identity still requires EDAS runtime validation.",
    "sources": [
      {
        "name": "Stable-Retro",
        "repository": "Farama-Foundation/stable-retro",
        "url": "https://github.com/Farama-Foundation/stable-retro",
        "source_path": "stable_retro/data/stable/StreetFighterIISpecialChampionEdition-Genesis-v0",
        "data_file": "stable_retro/data/stable/StreetFighterIISpecialChampionEdition-Genesis-v0/data.json",
        "rom_hash_file": "stable_retro/data/stable/StreetFighterIISpecialChampionEdition-Genesis-v0/rom.sha",
        "accessed_at": "2026-07-31",
        "address_conversion": "Stable-Retro Genesis source addresses in the 24-bit 0xFF0000-0xFFFFFF work-RAM range are represented as 64 KiB core_ram offsets by subtracting 0xFF0000. The equivalent sign-extended 68000 range is 0xFFFF0000-0xFFFFFFFF. The EDAS Mega Drive reader convention uses byte_order swap16 and big endian.",
        "limitations": "Stable-Retro source labels and types are useful technical evidence but are not a verification claim for this exact ROM, emulator core, or EDAS runtime."
      }
    ]
  }
}
